[
  {
    "listing_id": "pg_kor_001",
    "listing_name": "Zolo Nest PG, 5th Block Koramangala",
    "seller_language": "en",
    "base_rent": 12000,
    "deposit": 24000,
    "maintenance_monthly": 1000,
    "brokerage_onetime": 6000,
    "hidden_charges": 0,
    "lease_duration_months": 12,
    "amenities_included": ["wifi", "food_included", "security"],
    "effective_monthly_cost": 15500,
    "first_quoted_effective": 15500,
    "final_quoted_effective": 15500,
    "price_moved": false,
    "risk_flag": "verified",
    "fraud_signals": [],
    "commute_minutes": 32,
    "call_outcome": { "status": "itemized_quote" },
    "transcript_url": "https://scout.demo/transcripts/pg_kor_001.txt",
    "recording_url": "https://scout.demo/recordings/pg_kor_001.mp3"
  },
  {
    "listing_id": "pg_kor_002",
    "listing_name": "Comfort Stay PG, 6th Block Koramangala",
    "seller_language": "hi",
    "base_rent": 10000,
    "deposit": 20000,
    "maintenance_monthly": 1500,
    "brokerage_onetime": 4000,
    "hidden_charges": 0,
    "lease_duration_months": 12,
    "amenities_included": ["wifi", "food_included", "parking", "security"],
    "effective_monthly_cost": 13500,
    "first_quoted_effective": 14833,
    "final_quoted_effective": 13500,
    "price_moved": true,
    "risk_flag": "verified",
    "fraud_signals": [],
    "commute_minutes": 28,
    "call_outcome": { "status": "itemized_quote" },
    "transcript_url": "https://scout.demo/transcripts/pg_kor_002.txt",
    "recording_url": "https://scout.demo/recordings/pg_kor_002.mp3"
  },
  {
    "listing_id": "pg_kor_003",
    "listing_name": "Sunrise Luxury PG (unverified)",
    "seller_language": "en",
    "base_rent": 6000,
    "deposit": 30000,
    "maintenance_monthly": 0,
    "brokerage_onetime": 0,
    "hidden_charges": 0,
    "lease_duration_months": 12,
    "amenities_included": ["wifi", "food_included", "gym", "ac", "parking", "security"],
    "effective_monthly_cost": 8500,
    "first_quoted_effective": 8500,
    "final_quoted_effective": 8500,
    "price_moved": false,
    "risk_flag": "high_risk",
    "fraud_signals": ["pre_visit_deposit"],
    "commute_minutes": 30,
    "call_outcome": {
      "status": "declined",
      "reason": "Seller demanded the full deposit over GPay before allowing any visit; matched pre_visit_deposit fraud rule."
    },
    "transcript_url": "https://scout.demo/transcripts/pg_kor_003.txt",
    "recording_url": "https://scout.demo/recordings/pg_kor_003.mp3"
  }
]
